sourceElementName;sourceElementId;sourceCategorieComboId;destinationDataElementName;destinationDataElementId;destinationCategorieComboId
Endos-Nombre de cas de malnutris aigus sévères attendus;aaxVvcWrXnb;;Nombre de cas de malnutris aigus sévères attendus;uLviXAD6xk8;HllvX50cXC0
Endos-Nombre de cas de malnutris aigus sévères attendus;uwXNILzrSHX;;Nombre de cas de malnutris aigüs sévères attendus;bVNJmfmxNMU;HllvX50cXC0
Endos-Nombre total des enfants de 12 à 59 mois;SJKrcCexYJm;;Nombre total des enfants de 12 à 59 mois;VrAZGcvQ4xD;HllvX50cXC0
Endos-Nombre total des enfants âgés de 6 à 59 mois;AjdetEq2Ptm;;Nombre total des enfants âgés de 6 à 59 mois;CktZs3NyBs8;HllvX50cXC0
Endos-Population moins 1 an;qYN2GY8VzYG;;Population mois 1 an;jawuoioQ78K;HllvX50cXC0
