description;fis_description;fis_id;fis_groupe;fis_key;dhis_dataElementName;dhis_dataElementId;dhis_categorieComboName;dhis_categorieComboId;dhis_categorieComboOptionName;dhis_categorieComboOptionId
;;;quantite_cout;quantite;;;Quantite_Cout;UMaU0DHlm3l;Quantite;V3e0z6sQSCv
;;;quantite_cout;cout;;;Quantite_Cout;UMaU0DHlm3l;Cout;fsJKcn32fLi
;Accouchements normaux;6;quantite_cout;;I.1.1. ACCOUCHEMENTS NORMAUX ACCOUCHEMENTS;C67octzpAFq;Quantite_Cout;UMaU0DHlm3l;;
;Accouchements assistés à l'aide d'instruments/produits;7;quantite_cout;;I.1.2. ACCOUCHEMENTS ASSISTES A L'AIDE D'INSTRUMENTS ET/OU DE PRODUITS  ACCOUCHEMENT;ECCUlUYDsB4;Quantite_Cout;UMaU0DHlm3l;;
;Soins d’urgence aux nouveau-nés;8;quantite_cout;;I.1.3. SOINS D_URGENCE AUX NOUVEAU-NES ACCOUCHEMENT;Hw8coXjWZeu;Quantite_Cout;UMaU0DHlm3l;;
;Soins obstétricaux d’urgence;9;quantite_cout;;I.1.4. SOINS OBSTETRICAUX D_URGENCE ACCOUCHEMENT;EZxbRgA5BZq;Quantite_Cout;UMaU0DHlm3l;;
;Soins curatifs du post partum;11;quantite_cout;;I.1.5. SOINS CURATIFS DU POST PARTUM ACCOUCHEMENT;Aj5ekblACXc;Quantite_Cout;UMaU0DHlm3l;;
;Césariennes;12;quantite_cout;;I.1.6. CESARIENNES ACCOUCHEMENT;L2GKaySzx81;Quantite_Cout;UMaU0DHlm3l;;
;Laparatomie pour rupture utérine;93;quantite_cout;;I.1.7. LAPAROTOMIE POUR RUPTURE UTERINE ACCOUCHEMENT;EqG1g7F8N6Q;Quantite_Cout;UMaU0DHlm3l;;
;Laparotomie pour GEU;14;quantite_cout;;I.1.8. LAPAROTOMIE POUR GEU ACCOUCHEMENT;VVKi9MjBzmt;Quantite_Cout;UMaU0DHlm3l;;
;Cure de fistules obstétricales;15;quantite_cout;;I.1.9. CURE DE FISTULES OBSTETRICALES ACCOUCHEMENT;UE15LtMhNLd;Quantite_Cout;UMaU0DHlm3l;;
;II.2.1.Carburant évacuation;150;quantite_cout;;I.2.1. CARBURANT EVACUATION ACCOUCHEMENT;tlFGVNO6JDp;Quantite_Cout;UMaU0DHlm3l;;
;II.2.2.Montant total des médicaments et consommables médicaux;151;quantite_cout;;I.2.2. MONTANT TOTAL DES MEDICAMENTS ACCOUCHEMENT;b5zddUTPqbx;Quantite_Cout;UMaU0DHlm3l;;
;II.2.4.Actes (consultations);153;quantite_cout;;I.2.3. ACTES CONSULTATION_ACCOUCHEMENT_INTERVENTION_OBSTETRICALES;HWni6oxix39;Quantite_Cout;UMaU0DHlm3l;;
;II.2.5.Mise en observation/Hospitalisation;154;quantite_cout;;I.2.4. ACCOUCHEMENT HOSPITALISATION/MISE EN OBSERVATION ACCOUCHEMENT;GGj1rTezVkm;Quantite_Cout;UMaU0DHlm3l;;
;II.2.3.Examens complémentaires;152;quantite_cout;;I.2.5. EXAMENS COMPLEMENTAIRES ACCOUCHEMENT;treytA0cihL;Quantite_Cout;UMaU0DHlm3l;;
;Soins préventifs;34;quantite_cout;;II.1.1. SOINS PREVENTIFS GROSSESSE;wH8wwOjLuWn;Quantite_Cout;UMaU0DHlm3l;;
;Soins curatifs en ambulatoire;35;quantite_cout;;II.1.2. SOINS CURATIFS EN AMBULATOIRE GROSSESSE;W9RA9p4esbn;Quantite_Cout;UMaU0DHlm3l;;
;Soins curatifs en interne (hospitalisation ou mise en observation);36;quantite_cout;;II.1.3. SOINS CURATIFS EN INTERNE HOSPITALISATION OU MISE EN OBSERVATION GROSSESSE;HvpFmo9uYaQ;Quantite_Cout;UMaU0DHlm3l;;
;I.2.1.Carburant évacuation;140;quantite_cout;;II.2.1. CARBURANT EVACUATION GROSSESSE;YkBq4PRnLQO;Quantite_Cout;UMaU0DHlm3l;;
;I.2.2.Montant total des médicaments et consommables médicaux;141;quantite_cout;;II.2.2. MONTANT TOTAL DES MEDICAMENTS GROSSESSE;f7MEjWMvfWa;Quantite_Cout;UMaU0DHlm3l;;
;I.2.4.Actes (consultations);143;quantite_cout;;II.2.3. ACTES CONSULTATION_ACCOUCHEMENT_INTERVENTION GROSSESSE;P3bkU5bGGhU;Quantite_Cout;UMaU0DHlm3l;;
;I.2.5.Mise en observation/Hospitalisation;144;quantite_cout;;II.2.4. HOSPITALISATION/MISE EN OBSERVATION GROSSESSE;SzvzKYAuVGk;Quantite_Cout;UMaU0DHlm3l;;
;I.2.3.Examens complémentaires;142;quantite_cout;;II.2.5. EXAMENS COMPLEMENTAIRES GROSSESSE;alThHtLWpM6;Quantite_Cout;UMaU0DHlm3l;;
;Ligature des trompes;22;quantite_cout;;III.1.1. LIGATURE DES TROMPES PF;aWeJSDEnTBu;Quantite_Cout;UMaU0DHlm3l;;
;Sayana Press;29;quantite_cout;;III.1.10. SAYANA PRESS PF;KnG0D59pT9h;Quantite_Cout;UMaU0DHlm3l;;
;Pilule;30;quantite_cout;;III.1.11. PILULE PF;AK5b6ermOdI;Quantite_Cout;UMaU0DHlm3l;;
;Condom masculin;31;quantite_cout;;III.1.12. CONDOM MASCULIN PF;m5nUTyDn0jc;Quantite_Cout;UMaU0DHlm3l;;
;Condom féminin;32;quantite_cout;;III.1.13. CONDOM FEMININ PF;RDBwcoqxZoP;Quantite_Cout;UMaU0DHlm3l;;
;Collier;33;quantite_cout;;III.1.14. COLLIER PF;k8MYymX0LDF;Quantite_Cout;UMaU0DHlm3l;;
;Vasectomie;23;quantite_cout;;III.1.2. VASECTOMIE PF;N4IYjsBVk1Z;Quantite_Cout;UMaU0DHlm3l;;
;DIU insertion ou retrait;25;quantite_cout;;III.1.3. DIU INSERTION OU RETRAIT PF;bIuRc0t7VKU;Quantite_Cout;UMaU0DHlm3l;;
;Implant 5 ans insertion ou retrait;26;quantite_cout;;III.1.4. IMPLANT 5 ANS INSERTION OU RETRAIT PF;qFsddqNT8SR;Quantite_Cout;UMaU0DHlm3l;;
;Implant 3 ans insertion ou retrait;27;quantite_cout;;III.1.5. IMPLANT 3 ANS INSERTION OU RETRAIT PF;ey5T5fX5HaR;Quantite_Cout;UMaU0DHlm3l;;
;Depo-Provera;28;quantite_cout;;III.1.9. DEPO-PROVERA PF;gIPzhdHCt2E;Quantite_Cout;UMaU0DHlm3l;;
;V.2.2.Montant total des médicaments et consommables médicaux;161;quantite_cout;;III.2.1. MONTANT TOTAL DES MEDICAMENTS ET CONSOMMABLES MEDICAUX PF;SqSq6duOBuc;Quantite_Cout;UMaU0DHlm3l;;
;V.2.3.Examens complémentaires;162;quantite_cout;;III.2.2. EXAMENS COMPLEMENTAIRES PF;kgwsTITsUzy;Quantite_Cout;UMaU0DHlm3l;;
;V.2.4.Actes (consultations);163;quantite_cout;;III.2.3. ACTES PF;tss1eVyOJjH;Quantite_Cout;UMaU0DHlm3l;;
;V.2.1.Carburant évacuation;160;quantite_cout;;III.2.4. CARBURANT SI EVACUATION PF;lAqsZNzpmDX;Quantite_Cout;UMaU0DHlm3l;;
;Soins curatifs en ambulatoire;20;quantite_cout;;IV.1.1. SOINS CURATIFS EN AMBULATOIRE ENFANTS;InGas9oaZSN;Quantite_Cout;UMaU0DHlm3l;;
;Soins curatifs en hospitalisation;21;quantite_cout;;IV.1.2. SOINS CURATIFS EN HOSPITALISATION/MISE EN OBSERVATION ENFANTS;oRFOXKPOKOn;Quantite_Cout;UMaU0DHlm3l;;
;IV.2.1.Carburant évacuation;155;quantite_cout;;IV.2.1. CARBURANT EVACUATION ENFANTS;iFD7tnorZlt;Quantite_Cout;UMaU0DHlm3l;;
;IV.2.2.Montant total des médicaments et consommables médicaux;156;quantite_cout;;IV.2.2. MONTANT TOTAL DES MEDICAMENTS ENFANTS;O0h8l5hpREm;Quantite_Cout;UMaU0DHlm3l;;
;IV.2.4.Actes (consultations);158;quantite_cout;;IV.2.3. ACTES CONSULTATION_ACCOUCHEMENT_INTERVENTION ENFANTS;g74JOV7Vbnu;Quantite_Cout;UMaU0DHlm3l;;
;IV.2.5.Mise en observation/Hospitalisation;159;quantite_cout;;IV.2.4. HOSPITALISATION/MISE EN OBSERVATION ENFANTS;AU3K2CsEPT0;Quantite_Cout;UMaU0DHlm3l;;
;IV.2.3.Examens complémentaires;157;quantite_cout;;IV.2.5. EXAMENS COMPLEMENTAIRES ENFANTS;QoGjtjGiPVU;Quantite_Cout;UMaU0DHlm3l;;
;IVA/IVL;16;quantite_cout;;V.1.1. IVA/IVL DEPISTAGE;W42yK7NqsGA;Quantite_Cout;UMaU0DHlm3l;;
;Cryothérapie;17;quantite_cout;;V.1.2. CRYOTHERAPIE DEPISTAGE;XAIZKwukJRb;Quantite_Cout;UMaU0DHlm3l;;
;Résection à l’Anse Diathermique (RAD);18;quantite_cout;;V.1.3. RESECTION A L_ANSE DIATHERMIQUE RAD DEPISTAGE;eDb3M21Cwpm;Quantite_Cout;UMaU0DHlm3l;;
;III.2.2.Montant total des médicaments et consommables médicaux;146;quantite_cout;;V.2.1 MONTANT TOTAL DES MEDICAMENTS DEPISTAGE;J3WGodYDMPm;Quantite_Cout;UMaU0DHlm3l;;
;III.2.4.Actes (consultations);148;quantite_cout;;V.2.2. ACTES CONSULTATIONS_HOSPITALISATION DEPISTAGE;oXOXwucJXc9;Quantite_Cout;UMaU0DHlm3l;;
;III.2.3.Examens complémentaires;147;quantite_cout;;V.2.3. EXAMENS COMPLEMENTAIRES DEPISTAGE;soBSH0ujCXj;Quantite_Cout;UMaU0DHlm3l;;
;Paracetamol 500mg comprime, blister;219;quantite_cout;;VIII.10. PARACETAMOL 500MG;LOuRiOWwMBE;Quantite_Cout;UMaU0DHlm3l;;
;Artemether + Lumefantrine (20+120) mg-6 subv comp;39;quantite_cout;;VIII.11. ARTEMETER+LUMEFANTRINE20/120MG COMP (PLAQUETTE DE 6);VFpfWZmj1KU;Quantite_Cout;UMaU0DHlm3l;;
;Artemether + Lumefantrine (20+120) mg-12 subv comp;40;quantite_cout;;VIII.12. ARTEMETER+LUMEFANTRINE20/120MG COMP (PLAQUETTE DE 12);iOH23UerIIy;Quantite_Cout;UMaU0DHlm3l;;
;Artemether + Lumefantrine (20+120) mg-18 subv comp;35;quantite_cout;;VIII.13. ARTEMETER+LUMEFANTRINE20/120MG COMP (PLAQUETTE DE 18);AwjPPUrb6vV;Quantite_Cout;UMaU0DHlm3l;;
;Artemether + Lumefantrine (20+120) mg-24 subv comp;37;quantite_cout;;VIII.14. ARTEMETER+LUMEFANTRINE20/120MG COMP (PLAQUETTE DE 24);HF0yrrgBW7R;Quantite_Cout;UMaU0DHlm3l;;
;Dihydroartemisinini+pipéraquini (DHAPPQ);550;quantite_cout;;VIII.15. DIHYDROARTEMISININE 20MG+PIPERAQUINE 160MG;mv5REaDPcxk;Quantite_Cout;UMaU0DHlm3l;;
;Dihydroartemisinini+pipéraquini (DHAPPQ);550;quantite_cout;;VIII.16. DIHYDROARTEMISININE 20MG+PIPERAQUINE 320MG;KeuLZhnMluB;Quantite_Cout;UMaU0DHlm3l;;
;Artesunate rectal 50 mg;579;quantite_cout;;VIII.17. ARTESUNATE RECTAL 50MG;GzezSygn2fV;Quantite_Cout;UMaU0DHlm3l;;
;Artesunate rectal 100 mg;580;quantite_cout;;VIII.18. ARTESUNATE RECTAL 100MG;dH12nwszJij;Quantite_Cout;UMaU0DHlm3l;;
;Amoxicilline 250mg comprime dispersible, blister;27;quantite_cout;;VIII.19. AMOXICILLINE DISPERSIBLE 250MG;nHAeWSC2Egl;Quantite_Cout;UMaU0DHlm3l;;
;Sulfadoxine, pyrimethamine (500+25) mg comprime, blister;316;quantite_cout;;VIII.20. SULFADOXINE PYRRIMETHAMINE;uL2OGX5UUN1;Quantite_Cout;UMaU0DHlm3l;;
;Fer, acide folique (200+0,4) mg comprime, blister;132;quantite_cout;;VIII.21. FER ACIDE FOLIQUE (FAC);BQgckAsSNC0;Quantite_Cout;UMaU0DHlm3l;;
;Micronutriments multiples (MMS);583;quantite_cout;;VIII.22. MICRONUTRIMENTS MULTIPLES (MMS);WcWLmXtIeww;Quantite_Cout;UMaU0DHlm3l;;
;Poudre de Micronutriments multiples (MNP);584;quantite_cout;;VIII.23. POUDRE DE MICRONUTRIMENTS MULTIPLES (MNP);cBygk2rlX1Q;Quantite_Cout;UMaU0DHlm3l;;
;Contraceptifs oraux combines (COC);581;quantite_cout;;VIII.24. CONTRACEPTIFS ORAUX COMBINES (COC);oZ0yPtuPN3S;Quantite_Cout;UMaU0DHlm3l;;
;Contraceptifs oraux progestatifs (COP);582;quantite_cout;;VIII.25. CONTRACEPTIFS ORAUX PROGESTATIFS (COP);CgwZbgPb20m;Quantite_Cout;UMaU0DHlm3l;;
;SRO Zinc;315;quantite_cout;;VIII.26. KITS SRO/ZINC;DyusyCKUljm;Quantite_Cout;UMaU0DHlm3l;;
;Gant en vrac;145;quantite_cout;;VIII.27. GANTS EN VRAC;m6vDDgmJoD3;Quantite_Cout;UMaU0DHlm3l;;
;TDR palu;578;quantite_cout;;VIII.5. TDR PALUDISME COMMUNAUTAIRE;VHm5XZMdcC9;Quantite_Cout;UMaU0DHlm3l;;
;sayana presse;258;quantite_cout;;VIII.6. SAYANA PRESS COMMUNAUTAIRE;lJatyGrM2Zc;Quantite_Cout;UMaU0DHlm3l;;
;Pilule;229;quantite_cout;;VIII.7. PILULE COMMUNAUTAIRE;hDGs849wCtj;Quantite_Cout;UMaU0DHlm3l;;
;Preservatif masculin lubrifie, unite;246;quantite_cout;;VIII.8. CONDOM MASCULIN COMMUNAUTAIRE;oRrAn3CNnea;Quantite_Cout;UMaU0DHlm3l;;
;Preservatif feminin lubrifie, unite;245;quantite_cout;;VIII.9. CONDOM FEMININ COMMUNAUTAIRE;xLyQQh3rAMl;Quantite_Cout;UMaU0DHlm3l;;
